Ethereum Follow Protocol,44434.5,307.96,1561.95305,Ethereum,https://www.rootdata.com/Projects/detail/Polygon%20Zero?k=NTY2Ng%3D%3D,Layer-2 Optimistic rollup platform,"https://polygon.technology/solutions/polygon-zero, https://x.com/0xpolygonzero","Polygon Zero uses Plonky2's speed to enable a more scalable and decentralized ZK Layer 2. It offers both Rollup and Validium modes, giving users access to higher throughput and lower fees. The original name of Polygon Zero was Mir Protocol, which was renamed after being acquired by Polygon.",Mir Protocol,"Sandeep Nailwal, Daniel Lubarov, Brendan Farmer, Polygon, Polygon",,https://x.com/0xpolygonzero,13.29 K,353,"Dec 09, 2021 - Polygon Zero was acquired by Polygon","#Aztec Network, #zkSync, #Scroll, #Manta Network, #Morph, #DeGate, #Orbiter Finance, #Linea",0.6281511,"{'feat0': {'feat': 'CDLDARKCLOUDCOVER', 'data': [0.0]}, 'feat1': {'feat': 'CDL2CROWS', 'data': [0.0]}, 'feat2': {'feat': 'zsVol', 'data': [-0.2347577863169918]}, 'feat3': {'feat': 'DayOfWeek', 'data': [3.0]}, 'feat4': {'feat': 'MA_Ratio', 'data': [0.0046645219458777]}, 'feat5': {'feat': 'Month', 'data': [12.0]}, 'feat6': {'feat': 'MA_Ratio_short', 'data': [0.0117249147222639]}, 'feat7': {'feat': 'pct_change', 'data': [-0.0049750475101587]}, 'feat8': {'feat': 'Z_score', 'data': [-0.6237190305136764]}, 'feat9': {'feat': 'Hourly', 'data': [0.0]}}"
Fetch.aiFET,,0.3827,88626075.33,Bitcoin,https://www.rootdata.com/Projects/detail/Stacks?k=MTM%3D,Bitcoin L2,"https://www.stacks.co/, https://x.com/Stacks, https://www.linkedin.com/company/stacks-stx/, https://t.me/StacksChat, https://github.com/blockstack, https://docs.stacks.co/, https://blog.stacks.co/, https://coinmarketcap.com/currencies/stacks/, https://forum.stacks.org/","Stacks is a Bitcoin L2, bringing smart contract functionality to Bitcoin, without modifying Bitcoin itself. Stacks takes a pyramid approach, where you have the foundational settlement layer at the bottom (Bitcoin), and then a layer on top of that to add smart contracts and programmability (Stacks), and then layers on top of that for scalability and speed (Hiro's Subnets).",Blockstack,"Muneeb Ali, Ryan Shea, Brittany Laughlin, HashKey Capital, SNZ Holding, Union Square Ventures, The Spartan Group, Arrington Capital, IOSG Ventures, Fenbushi Capital, Fabric Ventures, HTX Ventures, Placeholder, Digital Currency Group, Blockchain Capital, FBG Capital, Fundamental Labs, Foundation Capital, Winklevoss Capital, Opensea, DLC.Link, StackSwap",,https://x.com/Stacks,201.78 K,211,"Sep 10, 2019 - Stacks raised $ 23 M in Public Sale round | Jul 24, 2019 - Stacks raised $ 7.6 M in funding round | Dec 04, 2017 - Stacks raised $ 52 M through ICO | Jan 06, 2017 - Stacks raised $ 4 M in Series A round | Nov 13, 2014 - Stacks raised $ 1.33 M in Seed round","#Merlin Chain, #Nubit, #BEVM, #BOB, #Mintlayer, #Hacash.com, #Rollux, #Bitroot",0.72902316,"{'feat0': {'feat': 'CDLBELTHOLD', 'data': [0.0]}, 'feat1': {'feat': 'CDLCOUNTERATTACK', 'data': [0.0]}, 'feat2': {'feat': 'Hourly', 'data': [0.0]}, 'feat3': {'feat': 'CDL3WHITESOLDIERS', 'data': [0.0]}, 'feat4': {'feat': 'CDLPIERCING', 'data': [0.0]}, 'feat5': {'feat': 'Month', 'data': [12.0]}, 'feat6': {'feat': 'CDLGRAVESTONEDOJI', 'data': [0.0]}, 'feat7': {'feat': 'CDLINVERTEDHAMMER', 'data': [0.0]}, 'feat8': {'feat': 'CDL3BLACKCROWS', 'data': [0.0]}, 'feat9': {'feat': 'zsVol', 'data': [-0.4731172506340246]}}"
FilecoinFIL,,59.194,312926.48,Solana,https://www.rootdata.com/Projects/detail/Dogwifhat?k=MTA2NTU%3D,Popular memecoin,"https://dogwifcoin.org/, https://x.com/dogwifcoin, https://coinmarketcap.com/currencies/dogwifhat/",Dogwifhat is a popular memecoin.,2023,,"https://decrypt.co/221974/dogwifhat-spat-ethereum-nft-auction-tensions-dog-owners-solana-community, https://www.coindesk.com/markets/2024/03/11/dogwifhat-community-plan-to-put-the-meme-on-the-vegas-sphere/?utm_medium=referral&utm_source=feedly&utm_campaign=headlines, https://decrypt.co/214038/solana-meme-coin-dogwifhat-soars-30-on-bitget-listing-sol-and-bonk-see-gains, https://thedefiant.io/solana-memecoin-wif-hits-all-time-high-on-binance-listing, https://finbold.com/dogwifhat-up-350-in-a-week-which-meme-coins-could-100x-next/",https://x.com/dogwifcoin,92.01 K,1528,,"#Dogecoin, #PEPE, #Memeland, #FLOKI, #SLERF, #Wen, #Moonshot, #BorpaToken",0.38941506,"{'feat0': {'feat': 'CDLDRAGONFLYDOJI', 'data': [0.0]}, 'feat1': {'feat': 'ULTOSC', 'data': [0.5203373015873277]}, 'feat2': {'feat': 'CDLENGULFING', 'data': [0.0]}, 'feat3': {'feat': 'Month', 'data': [12.0]}, 'feat4': {'feat': 'Hourly', 'data': [0.0]}, 'feat5': {'feat': 'Z_score', 'data': [-0.6926159828541356]}, 'feat6': {'feat': 'PR_MA_Ratio', 'data': [0.0056943423952788]}, 'feat7': {'feat': 'PR_MA_Ratio_short', 'data': [0.0107692307691833]}, 'feat8': {'feat': 'RSI', 'data': [0.5294932424343486]}, 'feat9': {'feat': 'boll', 'data': [0.4136131605556635]}}"
FLOKIFLOKI,,,,,https://www.rootdata.com/Projects/detail/OKX?k=Mzg5Nw%3D%3D,Cryptocurrency exchange,"https://okx.com/, https://x.com/okx, https://www.linkedin.com/company/okxofficial/, https://t.me/OKXOfficial_English, https://github.com/okx, https://exchainrpc.okex.org/docs/en/#overview, https://coinmarketcap.com/currencies/okb/","OKX is a cryptocurrency exchange that builds the next-gen financial ecosystem and provides spot, margin, futures, options, perpetual swaps trading, DeFi, lending, and mining services.",OKEx,"Star Xu, Hong Fang, Haider Rafique, Lennix Lai, Jason Lau, Gala Wen, Frank Zhang, Tracy Zhou, Jason Wang, Longling Capital, Ceyuan Ventures, MandraCapital, VenturesLab, Giant Interactive Group, Qian He Capital, Tim Draper, Fred Wang, Jiang Tao, Leo Wang, Cai Wensheng, BBX, OKX Chain, X Layer, OKX Ventures",,https://x.com/okx,4.1 M,279,"Nov 14, 2023 - OKX released zkEVM L2 Network X Layer | Jan 01, 2022 - OKEx changed its name to OKX | Jul 01, 2021 - OKX launched Web3 Wallet product | Dec 01, 2013 - OKX completed a Series A round | Jun 01, 2013 - OKX raised $ 1 M in Angel round","#Bullish, #Coinbase, #Blockchain.com, #Bakkt, #Binance, #KuCoin, #Kraken, #Gemini",,
Flow,,22.86,3156323.5,"Ethereum, Polygon, Avalanche",https://www.rootdata.com/Projects/detail/Aave?k=MTA2,Decentralized lending-borrowing protocol,"https://aave.com/, https://x.com/aave, https://t.me/Aavesome, https://github.com/aave, https://docs.aave.com/hub/, https://medium.com/aave, https://snapshot.org/#/aave.eth, https://coinmarketcap.com/currencies/aave/","Aave is a decentralized finance protocol for borrowing and lending, where users can participate as depositors or borrowers. Depositors provide liquidity to the market to earn a passive income, while borrowers are able to borrow in an overcollateralized (perpetually) or undercollateralized (one-block liquidity) fashion. AAVE is used as the center of gravity of Aave Protocol governance, allowing users to vote and decide on the outcome of Aave Improvement Proposals (AIPs). Additionally, AAVE can be staked within the protocol's Safety Module to provide security/insurance to the protocol and depositors. Stakers earn staking rewards and fees from the protocol.",2017,"Stani Kulechov, Emilio Frangella, Framework Ventures, ParaFi Capital, Standard Crypto, Blockchain Capital, Blockchain.com, DeFiance Capital, Ribbit Capital, DTC Capital, Three Arrows Capital, Fantom, Syndicate, Airstack, ORB, Delta Exchange, Avara",,https://x.com/aave,589.91 K,69,"Jan 27, 2023 - Aave V3 has been deployed to the Ethereum mainnet | Oct 05, 2020 - Aave raised $ 25 M | Jul 15, 2020 - Aave raised $ 3 M | Jul 09, 2020 - Aave raised $ 4.5 M | Jan 08, 2020 - Aave was live on mainnet","#Compound, #MakerDAO, #Parrot Protocol, #Abracadabra, #dForce, #Coin98 Finance, #Timeswap, #Alchemix",0.42580202,"{'feat0': {'feat': 'CDL3WHITESOLDIERS', 'data': [0.0]}, 'feat1': {'feat': 'CDLMORNINGDOJISTAR', 'data': [0.0]}, 'feat2': {'feat': 'CDL3BLACKCROWS', 'data': [0.0]}, 'feat3': {'feat': 'ULTOSC', 'data': [0.5318143459915609]}, 'feat4': {'feat': 'zsVol', 'data': [0.6915249163070935]}, 'feat5': {'feat': 'Z_score', 'data': [-0.9864961347292924]}, 'feat6': {'feat': 'PR_MA_Ratio', 'data': [-0.0067283282146012]}, 'feat7': {'feat': 'PR_MA_Ratio_short', 'data': [0.0108401084010716]}, 'feat8': {'feat': 'RSI', 'data': [0.5149413383660086]}, 'feat9': {'feat': 'boll', 'data': [0.4431025924385113]}}"
Flare NetworkFLR,,,,Ethereum,https://www.rootdata.com/Projects/detail/Arbitrum%20-%20Offchain%20Labs?k=MjczOA%3D%3D,Ethereum Layer2 scaling solution,"https://arbitrum.io/, https://x.com/arbitrum, https://www.linkedin.com/company/arbitrum/, https://medium.com/offchainlabs, https://snapshot.org/#/arbitrum-odyssey.eth, https://coinmarketcap.com/currencies/arbitrum/, https://defillama.com/chain/Arbitrum, https://link3.to/arbitrum","Arbitrum, created by the Offchain Labs team, is an Ethereum Layer2 scaling solution based on Optimistic Rollup technology. It leverages the ability to communicate between L1 and L2, allowing any form of Ethereum asset to be transferred between Layer 1 and Layer 2 without the need for trust. Even though Arbitrum transactions are still settled on Ethereum, only raw transaction data is submitted to Ethereum, with execution and contract storage occurring off-chain. This makes the gas fee required on Arbitrum much smaller than on the mainnet, and contracts are fully compatible with no gas limit.",2018,"Steven Goldfeder, Harry Kalodner, Edward Felten, Nina Rong, Patrick McCorry, Preston Van Loon, Pantera Capital, Lightspeed Venture, Coinbase Ventures, OKX Ventures, The Spartan Group, Polychain, Delphi Digital, Mechanism Capital, SNZ Holding, IOSG Ventures, Alliance DAO, HTX Ventures, Samsung Next, Blockchange Ventures, Standard Crypto, DeFiance Capital, Espresso Systems, Ingonyama, Treasure DAO, Clique, Curvance, Prysmatic Labs, idOS",,https://x.com/arbitrum,1.03 M,24,"Aug 31, 2021 - Arbitrum / Offchain Labs was live on mainnet | Aug 31, 2021 - Arbitrum / Offchain Labs raised $ 120 M in Series B round | Apr 01, 2021 - Arbitrum / Offchain Labs raised $ 20 M in Series A round | Apr 03, 2019 - Arbitrum / Offchain Labs raised $ 3.7 M in Seed round","#Eclipse, #MegaETH, #Karak, #Polygon Zero, #Optimism, #Base, #Polygon, #Aztec Network",,
FastexFTN,,,,,https://www.rootdata.com/Projects/detail/Filecoin?k=Mjk%3D,Decentralized storage network,"https://filecoin.io/, https://x.com/Filecoin, https://github.com/filecoin-project/, https://docs.filecoin.io/, https://coinmarketcap.com/currencies/filecoin/",Filecoin is a peer-to-peer network that enables anyone to store and retrieve data on the internet. Built-in economic incentives ensure that files are stored and retrieved reliably and continuously for the duration specified by the user.,2014,"Juan Benet, Sarah THIAM, Andreessen Horowitz, Pantera Capital, IOSG Ventures, Digital Currency Group, Union Square Ventures, GenBlock Capital, Blockchain Capital, Sequoia Capital, Fundamental Labs, Continue Capital, BlueYard Capital, Redline Labs, Winklevoss Capital, Mint Ventures, Sam Altman, Lit Protocol, Protocol Labs",,https://x.com/Filecoin,665.86 K,373,"Oct 15, 2020 - Filecoin was live on mainnet | Sep 01, 2017 - Filecoin raised $ 205 M through ICO | Aug 01, 2017 - Filecoin raised $ 52 M in Seed round","#Ethereum, #Solana, #Aleo, #Hedera, #ZetaChain, #Internet Computer / Dfinity, #Algorand, #Celo",,
GalaGALA,,0.06886,2530030308,Ethereum,https://www.rootdata.com/Projects/detail/Optimism?k=MTQwNQ%3D%3D,Ethereum L2 solution using optimistic rollup technology,"https://www.optimism.io/, https://x.com/Optimism, https://www.linkedin.com/company/optimism-foundation/, https://github.com/ethereum-optimism/, https://optimismpbc.medium.com/, https://snapshot.org/#/opcollective.eth, https://coinmarketcap.com/currencies/optimism-ethereum/, https://defillama.com/chain/Optimism",Optimism is an Ethereum Layer 2 solution that utilizes optimistic rollup technology. It drastically reduces costs and transaction times while preserving the benefits of Ethereum's security.,2018,"Karl Floersch, Jinglan Wang, Ben Jones, Mark Tyneway, Prithvi Subburaj, Ryan Wyatt, Tess Rinearson, Vivian (Wei) Tao, Amanda Jacobsen, Andreessen Horowitz, Paradigm, Coinbase Ventures, Robot Ventures, Wintermute, Nascent, HTX Ventures, IDEO CoLab Ventures, Alchemy Ventures, A.Capital","https://www.coindesk.com/business/2024/03/08/optimism-sells-89m-op-tokens-in-private-transaction/?utm_medium=referral&utm_source=feedly&utm_campaign=headlines, https://www.theblock.co/post/280044/delta-hardfork-results-in-fee-reduction-on-optimism-ecosystem-chains, https://www.coindesk.com/tech/2023/10/03/at-last-blockchain-developer-op-labs-delivers-fault-proofs-missing-from-core-design/, https://www.theblock.co/post/252205/optimism-selling-162-million-in-tokens-flags-imminent-transfer, https://www.theblock.co/post/233364/optimism-completes-upgrade-of-its-layer-2-network?utm_source=feedly&utm_medium=rss, https://messari.io/article/state-of-optimism-governance, https://cointelegraph.com/news/can-the-optimism-blockchain-win-the-battle-of-the-rollups, https://messari.io/article/the-value-of-optimism",,688.73 K,151,"Mar 08, 2024 - Optimism raised $ 89 M in funding round | Sep 20, 2023 - Optimism raised $ 162 M in funding round | Aug 25, 2023 - Base and Optimism Jointly Release Revenue Governance Sharing Protocol | Oct 18, 2022 - Optimism launches OP Stack, a modular component | Mar 17, 2022 - Optimism raised $ 150 M in Series B round","#Karak, #Polygon Zero, #Base, #Polygon, #Aztec Network, #StarkWare, #Arbitrum / Offchain Labs, #zkSync",0.27908006,"{'feat0': {'feat': 'MA_Ratio', 'data': [-0.0376524338269524]}, 'feat1': {'feat': 'PR_MA_Ratio_short', 'data': [0.0135806184636072]}, 'feat2': {'feat': 'Month', 'data': [12.0]}, 'feat3': {'feat': 'CDLSPINNINGTOP', 'data': [-1.0]}, 'feat4': {'feat': 'ULTOSC', 'data': [0.4949563065773602]}, 'feat5': {'feat': 'Z_score', 'data': [-0.6888727868602411]}, 'feat6': {'feat': 'PR_MA_Ratio', 'data': [0.010124868124792]}, 'feat7': {'feat': 'Hourly', 'data': [0.0]}, 'feat8': {'feat': 'RSI', 'data': [0.5165297986026602]}, 'feat9': {'feat': 'boll', 'data': [0.1245855237562848]}}"
The GraphGRT,,0.12275,281389717.4,Ethereum,https://www.rootdata.com/Projects/detail/Mantle%20Network?k=NTc4Mw%3D%3D,A high performance Ethereum layer-2 network with modular design,"https://www.mantle.xyz/, https://x.com/0xMantle, https://www.linkedin.com/company/0xmantle, https://t.me/mantlenetwork, https://mirror.xyz/0xMantle.eth, https://coinmarketcap.com/currencies/mantle/, https://defillama.com/chain/Mantle, https://link3.to/mantle","Mantle is a high-performance Ethereum layer-2 network built with a modular architecture that delivers low fees and high security. Builders can use Mantle's unique design to create dApps with an exceptional user experience, while also relying on Ethereum's unparalleled security. Mantle is a product of BitDAO and is governed by the $BIT community.",BitDAO,"Mark Veer, Derek Lim, Francesca Tay, Shubham Bhandari, Cooper Midroni, Pantera Capital, Dragonfly, Founders fund, The Spartan Group, Jump Capital, Kain Warwick, Alan Howard, Renzo Protocol, Lagrange, MetaCene, Lombard, GaiaNet, Blade Games, Usual, Agora, DreamOS, L3E7, BoomFi",,,766.8 K,51,"Jul 17, 2023 - Mantle Network was live on mainnet | Jan 10, 2023 - Mantle Network was live on testnet | Aug 18, 2021 - Mantle Network raised $ 356 M through IDO | Jun 16, 2021 - Mantle Network raised $ 230 M in funding round","#Eclipse, #Reya Network, #Boba Network, #Layer N, #Fraxtal, #TunaChain, #BitcoinVM, #Camp Network",0.72437364,"{'feat0': {'feat': 'CDLEVENINGDOJISTAR', 'data': [0.0]}, 'feat1': {'feat': 'CDLMORNINGSTAR', 'data': [0.0]}, 'feat2': {'feat': 'CDLHARAMICROSS', 'data': [0.0]}, 'feat3': {'feat': 'CDL3WHITESOLDIERS', 'data': [0.0]}, 'feat4': {'feat': 'PR_MA_Ratio_short', 'data': [0.0362682481751837]}, 'feat5': {'feat': 'Month', 'data': [12.0]}, 'feat6': {'feat': 'CDLHANGINGMAN', 'data': [0.0]}, 'feat7': {'feat': 'zsVol', 'data': [-0.1206997314377498]}, 'feat8': {'feat': 'Hourly', 'data': [0.0]}, 'feat9': {'feat': 'MA_Ratio_short', 'data': [0.0064371573660006]}}"
Gate.ioGT,,0.03052,5957429.8,,https://www.rootdata.com/Projects/detail/cryptonews24?k=MTA0NTE%3D,Crypto news aggregation platform,https://x.com/Xcryptonews24,"Cryptonews24 is an encrypted news aggregation platform that allows readers to find the latest crypto news, events, data, and indices.",2023,,,,--,--,,"#rekt, #Bitcoin.com, #Bitcoin Magazine, #Decrypt, #CoinDesk, #Blockworks, #Cointelegraph, #The Block",,
HederaHBAR,,0.03766,10296283.8,Ethereum,https://www.rootdata.com/Projects/detail/Immutable%20X?k=Mjkw,Layer 2 scaling solution for NFTs,"https://www.immutable.com/, https://x.com/Immutable, https://t.me/immutablex, https://docs.x.immutable.com/docs, https://immutablex.medium.com/, https://coinmarketcap.com/currencies/immutable-x/",Immutable X operates as the first-ever Layer 2 scaling solution for NFTs on the Ethereum blockchain. It utilizes zk rollup technology to address high gas fee and scalability issues when minting and trading NFTs.,2018,"James Ferguson, Alex Connolly, Robbie Ferguson, Coinbase Ventures, Delphi Digital, Alliance DAO, Framework Ventures, HTX Ventures, DIGITAL, Mint Ventures, Eterlast, MetaJuice, Immutable",,https://x.com/Immutable,420.07 K,1149,"Dec 22, 2023 - Immutable X completed a strategic financing | May 25, 2022 - Kongregate and Immutable X launch $40M blockchain game dev fund","#Ethernity, #Karak, #Polygon Zero, #Optimism, #Base, #Polygon, #Aztec Network, #StarkWare",0.69863814,"{'feat0': {'feat': 'CDLDARKCLOUDCOVER', 'data': [0.0]}, 'feat1': {'feat': 'CDLHANGINGMAN', 'data': [0.0]}, 'feat2': {'feat': 'CDLINVERTEDHAMMER', 'data': [0.0]}, 'feat3': {'feat': 'CDL3WHITESOLDIERS', 'data': [0.0]}, 'feat4': {'feat': 'CDLEVENINGDOJISTAR', 'data': [0.0]}, 'feat5': {'feat': 'Hourly', 'data': [0.0]}, 'feat6': {'feat': 'MA_Ratio', 'data': [0.0133663366336638]}, 'feat7': {'feat': 'Z_score', 'data': [-0.4948990734262624]}, 'feat8': {'feat': 'RSI', 'data': [0.5870229692848982]}, 'feat9': {'feat': 'boll', 'data': [0.4999999999994177]}}"
HeliumHNT,,2.888,4957603.887,Cosmos,https://www.rootdata.com/Projects/detail/Celestia?k=MTk4NA%3D%3D,Modular consensus and data availability network,"https://celestia.org/, https://x.com/CelestiaOrg, https://www.linkedin.com/company/celestiaorg/, https://t.me/CelestiaCommunity, https://github.com/celestiaorg, https://docs.celestia.org/, https://blog.celestia.org/, https://coinmarketcap.com/currencies/celestia/, https://www.coingecko.com/en/coins/celestia, https://forum.celestia.org/","Celestia is a modular blockchain network whose goal is to build a scalable data availability layer, enabling the next generation of scalable blockchain architectures - modular blockchains. Celestia scales by decoupling execution from consensus and introducing a new primitive, data availability sampling. It's built to enable anyone to easily deploy their own blockchain with minimal overhead.",LazyLedger,"Mustafa Al-Bassam, John Adler, Ismail Khoffi, Nick White, Jacob Arluck, Ekram Ahmed, Jeremy Sklaroff, Yaz Khoury, Polychain, Bain Capital Crypto, Binance Labs, Coinbase Ventures, OKX Ventures, HashKey Capital, The Spartan Group, Delphi Digital, IOSG Ventures, Maven 11, Galaxy, Protocol Labs, Placeholder, Blockchain Capital, eGirl Capital, Figment Capital, Modular Cloud",,,281.85 K,14,"Oct 31, 2023 - Celestia was live on mainnet | Oct 20, 2022 - Celestia raised $ 55 M in Series A round | May 25, 2022 - Celestia was live on testnet | Jun 15, 2021 - LazyLedger rebranded to Celestia | Mar 04, 2021 - Celestia raised $ 1.5 M in Seed round","#0G, #Avail, #0xVM, #Sunrise, #DILL, #Dymension, #Omni Network, #Eclipse",,
Internet Computer / DfinityICP,,579.82,595994.19,,https://www.rootdata.com/Projects/detail/THORChain?k=MjUz,Decentralized Liquidity Network,"https://thorchain.org/, https://x.com/THORChain, https://www.linkedin.com/company/thorchain-protocol/, https://t.me/thorchain_org, https://github.com/thorchain, https://github.com/thorchain/Resources/tree/master/Whitepapers/THORChain/whitepaper-en.md, https://medium.com/thorchain, https://coinmarketcap.com/currencies/thorchain/, https://defillama.com/protocol/thorchain","THORChain is a decentralized cross-chain AMM trading protocol, created by a group of anonymous cryptocurrency developers at Binance's Hackathon in 2018. Its aim is to decentralize cryptocurrency liquidity via a network of public THORNodes and ecosystem products. Access to its native and cross-chain liquidity is open to any person, product, or institution.",2018,"Delphi Digital, Multicoin Capital, Zero Age Ventures, THORSwap, Lends",,https://x.com/THORChain,247.58 K,1656,"Jul 22, 2021 - THORChain losed $ 8 M in hack | Apr 13, 2021 - THORChain was live on mainnet","#Ethereum, #Solana, #Conflux, #Aleo, #Anoma Network, #PlatON, #Concordium, #NYM",0.67569256,"{'feat0': {'feat': 'CDLEVENINGDOJISTAR', 'data': [0.0]}, 'feat1': {'feat': 'CDLSHOOTINGSTAR', 'data': [0.0]}, 'feat2': {'feat': 'CDLMORNINGDOJISTAR', 'data': [0.0]}, 'feat3': {'feat': 'CDL2CROWS', 'data': [0.0]}, 'feat4': {'feat': 'Z_score', 'data': [-0.8479168783823732]}, 'feat5': {'feat': 'ULTOSC', 'data': [0.5867672841165034]}, 'feat6': {'feat': 'Month', 'data': [12.0]}, 'feat7': {'feat': 'Hourly', 'data': [0.0]}, 'feat8': {'feat': 'RSI', 'data': [0.595149853342876]}, 'feat9': {'feat': 'boll', 'data': [0.1954465951842899]}}"
Immutable XIMX,,3.732,1244180.7,Cosmos,https://www.rootdata.com/Projects/detail/Injective?k=Mjc3,Layer1 Blockchain Optimized for DeFi Applications,"https://injective.com/, https://x.com/injective, https://t.me/joininjective, https://github.com/InjectiveLabs, https://chain.injective.network/, https://medium.com/injective-labs, https://coinmarketcap.com/currencies/injective/, https://link3.to/injective","Injective is an interoperable layer one blockchain powering next-generation DeFi applications. It uniquely provides plug-and-play financial infrastructure primitives, such as a high-performance on-chain decentralized exchange infrastructure, decentralized bridges, oracles, and a composable smart contract layer with CosmWasm.",2018,"Eric Chen, Albert Chon, Mirza Uddin, Noah Axler, Christopher Choi, Bojan Angjelkoski, Pantera Capital, Jump Crypto, Binance Labs, Hashed, CMS Holdings, BlockTower Capital, Bitscale Capital, BH Digital, QCP Capital, Axia8 Ventures, BoxOne Ventures, QCP Soteria, Mark Cuban, Bitlink Capital, Astar, Galxe, Burnt (XION), Symbiosis Finance, Hydro Protocol",,https://x.com/injective,532.99 K,490,"Jan 25, 2023 - Injective establishes a $150 million eco-fund | Aug 10, 2022 - Injective raised $ 40 M | Nov 16, 2021 - Injective was live on mainnet | Apr 21, 2021 - Injective raised $ 10 M | Oct 20, 2020 - Injective raised $ 3.6 M in Public Sale round","#Vega Protocol, #Nibiru, #Ethereum, #Solana, #Agoric, #Tabi, #Dymension, #Berachain",0.5761823,"{'feat0': {'feat': 'CDLUPSIDEGAP2CROWS', 'data': [0.0]}, 'feat1': {'feat': 'CDL3WHITESOLDIERS', 'data': [0.0]}, 'feat2': {'feat': 'CDLHANGINGMAN', 'data': [0.0]}, 'feat3': {'feat': 'MA_Ratio_short', 'data': [0.0114059818716584]}, 'feat4': {'feat': 'CDLDRAGONFLYDOJI', 'data': [1.0]}, 'feat5': {'feat': 'CDLMORNINGSTAR', 'data': [0.0]}, 'feat6': {'feat': 'Hourly', 'data': [0.0]}, 'feat7': {'feat': 'Month', 'data': [12.0]}, 'feat8': {'feat': 'PR_MA_Ratio', 'data': [0.0760565959979843]}, 'feat9': {'feat': 'pct_change', 'data': [0.0]}}"
InjectiveINJ,,0.8027,24731060.19,Solana,https://www.rootdata.com/Projects/detail/Sonic?k=MTIxMjc%3D,Gaming Chain on Solana,"https://www.sonic.game/, https://x.com/SonicSVM, https://link3.to/mirrorworld","Sonic is a Gaming Chain on Solana and proposes the first expansion architecture HyperGrid, which can help game developers efficiently process and manage game status, logic and events. Sonic is 100% compatible with all EVM smart contracts and has a native game engine, providing game developers with comprehensive On-Chain game development components.",2024,"Chris Zhu, Republic Capital, Bitkraft Ventures, Galaxy Interactive, OKX Ventures, Mirana Ventures, Mask Network, Infinity Ventures Crypto, LD Capital, Big Brain Holdings, Alchemy Ventures, Sanctor Capital, Sky9 Capital, W3GG, LucidBlue Ventures, Avocado DAO, Bas1s Ventures, Mirror World",,https://x.com/SonicSVM,276.89 K,924,"Jun 18, 2024 - Sonic raised $ 12 M in Series A round | Apr 12, 2023 - Sonic completed a Pre-A round | Mar 11, 2022 - Sonic raised $ 4 M in Seed round","#Forte, #Tabi, #Game Space, #Enjin, #COMBO, #XAI, #Joyride Games, #Planetarium Labs",0.652464,"{'feat0': {'feat': 'CDL3BLACKCROWS', 'data': [0.0]}, 'feat1': {'feat': 'CDLHANGINGMAN', 'data': [0.0]}, 'feat2': {'feat': 'CDLEVENINGDOJISTAR', 'data': [0.0]}, 'feat3': {'feat': 'CDLDARKCLOUDCOVER', 'data': [0.0]}, 'feat4': {'feat': 'CDLABANDONEDBABY', 'data': [0.0]}, 'feat5': {'feat': 'CDLDRAGONFLYDOJI', 'data': [0.0]}, 'feat6': {'feat': 'CDLGRAVESTONEDOJI', 'data': [0.0]}, 'feat7': {'feat': 'pct_change', 'data': [-0.0028392958546279]}, 'feat8': {'feat': 'MA_Ratio', 'data': [-0.016685994460029]}, 'feat9': {'feat': 'PR_MA_Ratio', 'data': [0.0730216926367315]}}"
