Name,daily total trading volume,Prices,Volume,Ecology,Hyperlink,Project Description,Official Hyperlink List,Details,Founded Date,Funders,Related News Links,Twitter Hyperlink,Followers,Following,Significant Events,Similar Projects,AIScore,Explains
AaveAAVE,,47.099,13042.026,Bitcoin,https://www.rootdata.com/Projects/detail/BitcoinVM?k=MTEzNzQ%3D,Modular Bitcoin Layer2,"https://www.bitcoinvm.network/, https://x.com/BitcoinVM_BVM, https://bitcoinvm.gitbook.io/bitcoinvm-docs/bitcoinvm/overview, https://bitcoinvm.medium.com/",BitcoinVM is a modular Bitcoin Layer2 Compatible with EVM. Backed by BakerySwap. Allow use BTC as gas & native currency and deploy customized Bitcoin Layer2 easily with BVM Stack.,2023,,https://bitcoinvm.medium.com/introducing-bitcoinvm-an-evm-compatible-bitcoin-layer2-3eab6f904393,,--,--,,"#Eclipse, #Reya Network, #Boba Network, #Mantle Network, #Layer N, #TunaChain, #Fraxtal, #Camp Network",0.48436,"{'feat0': {'feat': 'CDLENGULFING', 'data': [0.0]}, 'feat1': {'feat': 'MA_Ratio', 'data': [0.0197136545304307]}, 'feat2': {'feat': 'Month', 'data': [12.0]}, 'feat3': {'feat': 'pct_change', 'data': [-0.0076569678407351]}, 'feat4': {'feat': 'DayOfWeek', 'data': [3.0]}, 'feat5': {'feat': 'PR_MA_Ratio', 'data': [0.071641198650526]}, 'feat6': {'feat': 'Hourly', 'data': [0.0]}, 'feat7': {'feat': 'Z_score', 'data': [-0.7342218930121919]}, 'feat8': {'feat': 'MA_Ratio_short', 'data': [0.0254932164041136]}, 'feat9': {'feat': 'boll', 'data': [0.5361787302893662]}}"
CardanoADA,,0.25698,29567756.16,,https://www.rootdata.com/Projects/detail/Ethereum%20Follow%20Protocol?k=MTA4MTI%3D,The social graph for Ethereum,"https://ethfollow.xyz/, https://x.com/ethfollowpr, https://docs.ethfollow.xyz/","Ethereum Follow Protocol is an onchain (L1 + L2s) social graph protocol for ethereum accounts designed to fit together with the other existing ethereum identity legos, like ENS. It can provide the social background of the Ethereum account, message contacts, suggestions based on friends' activities and other features.",2023,Brantly Millegan,,https://x.com/ethfollowpr,2.78 K,3,,"#Lens Protocol, #Farcaster, #Cyber, #Relation, #Releap Protocol, #5Degrees, #Rariko, #Kleo Network",0.7030428,"{'feat0': {'feat': 'CDLMARUBOZU', 'data': [0.0]}, 'feat1': {'feat': 'CDL2CROWS', 'data': [0.0]}, 'feat2': {'feat': 'CDLRISEFALL3METHODS', 'data': [0.0]}, 'feat3': {'feat': 'CDLHARAMICROSS', 'data': [0.0]}, 'feat4': {'feat': 'Hourly', 'data': [0.0]}, 'feat5': {'feat': 'CDLINVERTEDHAMMER', 'data': [0.0]}, 'feat6': {'feat': 'ULTOSC', 'data': [0.5936535312758997]}, 'feat7': {'feat': 'CDLDRAGONFLYDOJI', 'data': [0.0]}, 'feat8': {'feat': 'pct_change', 'data': [-0.0043928459366173]}, 'feat9': {'feat': 'zsVol', 'data': [-0.677670512240137]}}"
AerodromeAERO,,,,,https://www.rootdata.com/Projects/detail/Tether?k=NDEzOQ%3D%3D,The largest issuer of stablecoin in the world,"https://tether.to/, https://x.com/Tether_to/, https://www.linkedin.com/company/tether, https://t.me/OfficialTether","Tether is the largest issuer of stablecoin in the world, designed to facilitate the use of fiat currencies in a digital manner. It gives customers the ability to transact with traditional currencies on the blockchain, without the volatility and complexity usually associated with digital currencies. All Tether tokens are pegged 1-to-1 to the corresponding fiat currency and are backed 100% by Tether's reserves.",2014,"Jean-Louis van der Velde, William E. Quigley, Paolo Ardoino, Claudia L., Giancarlo Devasini, Blockstream, Bitdeer, XREX, Oobit, Northern Data, Holepunch, Citypay, Volcano Energy, Infinite Fleet / Exordium",,https://x.com/Tether_to/,488.84 K,245,,"#Paxos, #Circle, #Agora, #First Digital, #OneCash, #BiLira, #Centre, #Stably",,
AlgorandALGO,,2.554,4547615.806,,https://www.rootdata.com/Projects/detail/Binance.US?k=MzkwNw%3D%3D,Cryptocurrency exchange,"https://www.binance.us/, https://x.com/binanceus, https://www.linkedin.com/company/binance-us, https://t.me/Binance_USA, https://blog.binance.us/","Launched in September 2019, Binance.US is a cryptocurrency exchange established to serve U.S. consumers and comply with U.S. regulations.",2019,"Norman Reed, Christopher Blodgett, Lesley O'Neill, Jasmine Lee, Gin Chao, No Limit Holdings, Tribe Capital, Circle Ventures, Fundamental Labs, Foundation Capital, VanEck, Gaingels, RRE Ventures, NLVC, Original Capital, Gold House, Custodia, Figment",,https://x.com/binanceus,456.02 K,158,"Apr 06, 2022 - Binance.US raised $ 200 M in Seed round","#Coinbase, #Bakkt, #Kraken, #Gemini, #Abra, #CoinList, #River Financial, #Bullish",0.69957477,"{'feat0': {'feat': 'CDL2CROWS', 'data': [0.0]}, 'feat1': {'feat': 'CDLDRAGONFLYDOJI', 'data': [0.0]}, 'feat2': {'feat': 'CDLBELTHOLD', 'data': [0.0]}, 'feat3': {'feat': 'CDLCOUNTERATTACK', 'data': [0.0]}, 'feat4': {'feat': 'CDLEVENINGSTAR', 'data': [0.0]}, 'feat5': {'feat': 'CDLGRAVESTONEDOJI', 'data': [0.0]}, 'feat6': {'feat': 'CDLHARAMICROSS', 'data': [0.0]}, 'feat7': {'feat': 'CDLSHOOTINGSTAR', 'data': [0.0]}, 'feat8': {'feat': 'CDL3BLACKCROWS', 'data': [0.0]}, 'feat9': {'feat': 'RSI', 'data': [0.5807921700120507]}}"
OthersideAPE,,7.3658,25011657.51,Solana,https://www.rootdata.com/Projects/detail/SolanaPrime?k=NDk5OQ%3D%3D,IDO Launchpad,"https://solanaprime.com/, https://x.com/solana_prime, https://t.me/SolanaPrimeOfficial, https://medium.com/solanaprime, https://coinmarketcap.com/currencies/solanaprime/, https://www.coingecko.com/en/coins/solanaprime","SolanaPrime, an IDO Launchpad powered by Solana, will be the primary market gateway for the next generation of DeFi, GameFi, and Metaverse dApps to launch on the Solana ecosystem. This can be done either as a direct token participation in the IDO or an indirect exposure to SolanaPrime in its entirety (through the SPIX token).",2022,"Contango Digital Assets, ZBS capital, Baselayer Capital, Sheesha Finance, Pluto Digital, Faculty Capital, Llama Ventures, Nodeseeds, Arenum, Influx Group",https://cointelegraph.com/press-releases/solanaprime-closes-seed-round-for-primary-market-gamefi-and-defi-dapp-on-solana,https://x.com/solana_prime,15.31 K,103,"Feb 05, 2022 - SolanaPrime completed a Seed round","#Jupiter, #Bounce Finance, #DAO Maker, #MOBY, #Duckdao, #Poolz Finance, #Impossible Finance, #Velar",0.29779917,"{'feat0': {'feat': 'CDL2CROWS', 'data': [0.0]}, 'feat1': {'feat': 'Month', 'data': [12.0]}, 'feat2': {'feat': 'CDLSHOOTINGSTAR', 'data': [0.0]}, 'feat3': {'feat': 'zsVol', 'data': [-0.3151933025541582]}, 'feat4': {'feat': 'Hourly', 'data': [0.0]}, 'feat5': {'feat': 'ULTOSC', 'data': [0.4722061704896772]}, 'feat6': {'feat': 'Z_score', 'data': [-1.2508990098379185]}, 'feat7': {'feat': 'MA_Ratio_short', 'data': [0.0990191434912631]}, 'feat8': {'feat': 'RSI', 'data': [0.5226287401053882]}, 'feat9': {'feat': 'boll', 'data': [0.1775626535136817]}}"
AptosAPT,,6.8147,25662674.39,Base,https://www.rootdata.com/Projects/detail/circle.tech?k=MTIyOTQ%3D,Q&A paywall,"https://circle.tech/, https://x.com/teamcircletech, https://docs.circle.tech/","Circle.tech allows anyone to paywall access to their time. Allow people to connect with you through questions and personal 1-on-1 private chatrooms. Earn and monetize your time by answering questions and allowing people to connect with you. Whether for fun, business, connections or relationships, circle.tech provides an intimate space for people to connect and find their inner circle.",2024,,,,--,--,,"#Mirror, #Trends Market, #Lunchbreak, #Kurobi, #Koraplay, #Tomo, #Freeper, #SociaPol",0.7006547,"{'feat0': {'feat': 'CDLENGULFING', 'data': [0.0]}, 'feat1': {'feat': 'CDLBELTHOLD', 'data': [0.0]}, 'feat2': {'feat': 'CDLRISEFALL3METHODS', 'data': [0.0]}, 'feat3': {'feat': 'CDLMORNINGSTAR', 'data': [0.0]}, 'feat4': {'feat': 'Month', 'data': [12.0]}, 'feat5': {'feat': 'Z_score', 'data': [-0.4681639890962192]}, 'feat6': {'feat': 'ULTOSC', 'data': [0.5518819536324108]}, 'feat7': {'feat': 'Hourly', 'data': [0.0]}, 'feat8': {'feat': 'boll', 'data': [0.55622390210149]}, 'feat9': {'feat': 'RSI', 'data': [0.5490143633421735]}}"
ArweaveAR,,32.272,1677703.74,,https://www.rootdata.com/Projects/detail/Ripple?k=MTA%3D,International remittance solution,"https://xrpl.org/, https://x.com/Ripple, https://github.com/ripple/rippled, https://ripple.com/files/ripple_consensus_whitepaper.pdf, https://coinmarketcap.com/currencies/xrp/","Ripple is a real-time gross settlement system, currency exchange, and remittance network created by Ripple Labs Inc., a US-based technology company. Released in 2012, Ripple is based on a distributed open source protocol and supports tokens representing fiat currency, cryptocurrency, commodities, or other units of value. It claims to enable ""secure, instant, and nearly free global financial transactions of any size with no chargebacks"".",2012,"Brad Garlinghouse, Chris Larsen, David Schwartz, Monica Long, Stuart Alderoty, Don Steul, Jack McDonald, Eric van Miltenburg, Kiersten Hollars, Tetragon, Andreessen Horowitz, Pantera Capital, Polychain, Digital Currency Group, Lightspeed Venture, Blockchain Capital, IDG Capital, RRE Ventures, MV Global, SCB Digital Ventures, Abstract Ventures, SBI Holdings, Accenture Ventures, Standard Chartered, Wicklow Capital, Securitize, Hex Trust, Vega Protocol, Futureverse, Standard Custody & Trust, Flowdesk, Metaco, Keyrock, Mintable, Thallo, Heirloom, Supermojo, PDAX, Keyless, Dharma Labs, Dragonfly, Blockchain Founders Fund, Metaco, XRP Ledger, Fortress Trust, Standard Custody & Trust",,https://x.com/Ripple,2.72 M,986,"Sep 29, 2021 - Ripple announces $250 million fund to support NFT projects on XRP Ledger | Dec 20, 2019 - Ripple raised $ 200 M in Series C round | Sep 15, 2016 - Ripple raised $ 55 M in Series B round | May 19, 2015 - Ripple raised $ 28 M in Series A round | Apr 11, 2013 - Ripple completed an Angel round","#BitPay, #MoonPay, #Custodia, #Strike, #BCB Group, #Tribal Credit, #Ramp, #Qulian Technology",0.7180043,"{'feat0': {'feat': 'CDLDRAGONFLYDOJI', 'data': [0.0]}, 'feat1': {'feat': 'CDL3BLACKCROWS', 'data': [0.0]}, 'feat2': {'feat': 'MA_Ratio_short', 'data': [-0.0045266502173212]}, 'feat3': {'feat': 'PR_MA_Ratio', 'data': [0.0294180988069139]}, 'feat4': {'feat': 'Hourly', 'data': [0.0]}, 'feat5': {'feat': 'MA_Ratio', 'data': [-0.0175505411152433]}, 'feat6': {'feat': 'Z_score', 'data': [-0.8922381826234557]}, 'feat7': {'feat': 'Month', 'data': [12.0]}, 'feat8': {'feat': 'ULTOSC', 'data': [0.5239690823697946]}, 'feat9': {'feat': 'RSI', 'data': [0.5704414989109421]}}"
Arbitrum / Offchain LabsARB,,,,,https://www.rootdata.com/Projects/detail/Dogecoin?k=MTk%3D,Open source peer-to-peer digital currency,"https://x.com/dogecoin, https://github.com/dogecoin/dogecoin, https://github.com/dogecoin/dogecoin/blob/master/README.md, https://coinmarketcap.com/currencies/dogecoin/","Dogecoin is an open-source, peer-to-peer digital currency.",2013,"Jackson Palmer, Marshall Hayner, Angel Versetti","https://www.gemini.com/cryptopedia/dogecoin-joke-cryptocurrency, https://decrypt.co/56299/why-celebrities-love-dogecoin-from-elon-musk-to-lil-yachty",https://x.com/dogecoin,3.97 M,24,,"#Bitcoin, #Litecoin, #Worldcoin, #Decred, #Zcash, #Dash, #Monero, #MobileCoin",,
CosmosATOM,,3.953,1011759.375,TON,https://www.rootdata.com/Projects/detail/The%20Open%20Network?k=OTkz,A fully decentralized Layer1 blockchain designed by Telegram,"https://ton.org/, https://x.com/ton_blockchain, https://t.me/tonblockchain, https://github.com/newton-blockchain, https://ton.org/docs, https://coinmarketcap.com/currencies/toncoin/, https://defillama.com/chain/TON","TON (The Open Network) is a fully decentralized Layer-1 blockchain designed by Telegram. It offers ultra-fast transactions, minimal fees, easy-to-use apps, and is eco-friendly.",2021,"Pavel Durov, Steve Yun, Inal Kardan, Jordan Dunne, Lisa Ferdman, Julian Tan, Pantera Capital, Animoca Brands, Cypher Capital Group, Mask Network, Mirana Ventures, NGC Ventures, M-Ventures, Catizen",,https://x.com/ton_blockchain,2.37 M,772,"Mar 06, 2024 - The Open Network raised $ 8 M in funding round | Jul 07, 2022 - TON Foundation raised $90 million for its Alpha-Vista Fund | Apr 11, 2022 - TON Foundation raised $250 million for its first ecosystem fund | Jun 01, 2020 - The Open Network was live on mainnet","#Ethereum, #Solana, #Conflux, #Agoric, #Aleo, #Anoma Network, #Injective, #PlatON",0.7118753,"{'feat0': {'feat': 'CDLDARKCLOUDCOVER', 'data': [0.0]}, 'feat1': {'feat': 'CDL3BLACKCROWS', 'data': [0.0]}, 'feat2': {'feat': 'Month', 'data': [12.0]}, 'feat3': {'feat': 'CDLENGULFING', 'data': [0.0]}, 'feat4': {'feat': 'Hourly', 'data': [0.0]}, 'feat5': {'feat': 'zsVol', 'data': [-0.4749125226401195]}, 'feat6': {'feat': 'MA_Ratio_short', 'data': [0.0046745956653713]}, 'feat7': {'feat': 'PR_MA_Ratio', 'data': [0.0421718838205974]}, 'feat8': {'feat': 'PR_MA_Ratio_short', 'data': [0.0373228190669961]}, 'feat9': {'feat': 'pct_change', 'data': [-0.0007623403849817]}}"
AvalancheAVAX,,4.9096,6369386.27,,https://www.rootdata.com/Projects/detail/Cardano?k=NTA%3D,Public blockchain,"https://www.cardano.org/, https://x.com/cardano, https://www.linkedin.com/company/cardano-foundation, https://t.me/Cardano, https://cardanoupdates.com/, https://docs.cardano.org/en/latest/, https://cardano.org/newsletter/, https://coinmarketcap.com/currencies/cardano/, https://forum.cardano.org/, https://defillama.com/chain/Cardano","Cardano is an open-source, decentralized, and public blockchain platform. Consensus is achieved using proof of stake. Development of the platform began in 2015, and it was launched in 2017 by Charles Hoskinson, a co-founder of Ethereum.",2015,"Frederik Gregaard, Charles Hoskinson, Jeremy Wood, Giorgio Zinetti, Babajide Fashola, Bit2Me, Protego Trust Bank",,https://x.com/cardano,1.37 M,466,"Sep 12, 2021 - Cardano launched smart contracts after successful hard fork | Sep 29, 2017 - Cardano was live on mainnet","#Ethereum, #Solana, #Conflux, #Aleo, #Anoma Network, #PlatON, #Concordium, #NYM",0.7277601,"{'feat0': {'feat': 'CDL2CROWS', 'data': [0.0]}, 'feat1': {'feat': 'MA_Ratio', 'data': [-0.0006413063880581]}, 'feat2': {'feat': 'ULTOSC', 'data': [0.5451818253954038]}, 'feat3': {'feat': 'CDLEVENINGDOJISTAR', 'data': [0.0]}, 'feat4': {'feat': 'CDLSHOOTINGSTAR', 'data': [0.0]}, 'feat5': {'feat': 'PR_MA_Ratio_short', 'data': [0.0388524960469846]}, 'feat6': {'feat': 'CDLDRAGONFLYDOJI', 'data': [0.0]}, 'feat7': {'feat': 'CDLPIERCING', 'data': [0.0]}, 'feat8': {'feat': 'zsVol', 'data': [-0.5194572394272088]}, 'feat9': {'feat': 'pct_change', 'data': [-0.0007604562737641]}}"
Axie InfinityAXS,,0.15487,56813999.7,,https://www.rootdata.com/Projects/detail/Tron?k=MTE5,Layer-one blockchain,"https://tron.network/, https://x.com/trondao, https://github.com/tronprotocol/java-tron, https://medium.com/@Tronfoundation, https://coinmarketcap.com/currencies/tron/, https://defillama.com/chain/Tron",Tron is committed to accelerating the decentralization of the Internet through blockchain technology and decentralized applications (DApps).,2017,"Justin Sun, BitTorrent, Cassava Network, OpenOcean, Few and Far, Playbux, XY Finance, Steem, Multichain, Lino Network, CoinPlay, Cadenza Ventures",,https://x.com/trondao,1.52 M,574,"Jun 25, 2018 - Tron was live on mainnet","#Ethereum, #Solana, #Conflux, #Aleo, #Anoma Network, #PlatON, #Concordium, #NYM",0.7035602,"{'feat0': {'feat': 'CDLEVENINGDOJISTAR', 'data': [0.0]}, 'feat1': {'feat': 'CDL2CROWS', 'data': [0.0]}, 'feat2': {'feat': 'CDL3WHITESOLDIERS', 'data': [0.0]}, 'feat3': {'feat': 'CDLSHOOTINGSTAR', 'data': [0.0]}, 'feat4': {'feat': 'CDLUPSIDEGAP2CROWS', 'data': [0.0]}, 'feat5': {'feat': 'CDLGRAVESTONEDOJI', 'data': [0.0]}, 'feat6': {'feat': 'ULTOSC', 'data': [0.5255679047559096]}, 'feat7': {'feat': 'Hourly', 'data': [0.0]}, 'feat8': {'feat': 'RSI', 'data': [0.5791018430244709]}, 'feat9': {'feat': 'boll', 'data': [0.4007567542035013]}}"
Bitcoin CashBCH,873.422,219.04,1841.38023,Ethereum,https://www.rootdata.com/Projects/detail/Shiba%20Inu?k=NjIw,Decentralized meme token,"https://shibatoken.com/, https://twitter.com/shibtoken, https://github.com/shytoshikusama/woofwoofpaper/raw/main/SHIBA_INU_WOOF_WOOF.pdf, https://coinmarketcap.com/currencies/shiba-inu/",Shiba Inu is a decentralized meme token that has evolved into a vibrant ecosystem.,2020,"Cypher Capital Group, Animoca Brands, Foresight Ventures, P2 Ventures, Shima Capital, Morningstar Ventures, Mechanism Capital, Kenetic Capital, Woodstock, Big Brain Holdings, Comma3 Ventures, Spirit DAO, Hercules Ventures, Stake Capital, Primal Capital, Illuminati Capital, ShibaSwap, Shibarium",,https://twitter.com/shibtoken,3.87 M,24,"Apr 22, 2024 - Shiba Inu raised $ 12 M in funding round","#PEPE, #Dogecoin, #Memeland, #FLOKI, #Kishu Inu, #Color Protocol, #HarryPotterObamaSonic10Inu, #BorpaToken",0.40447965,"{'feat0': {'feat': 'CDLMORNINGSTAR', 'data': [0.0]}, 'feat1': {'feat': 'CDLMARUBOZU', 'data': [0.0]}, 'feat2': {'feat': 'ULTOSC', 'data': [0.5414528665403201]}, 'feat3': {'feat': 'Hourly', 'data': [0.0]}, 'feat4': {'feat': 'Month', 'data': [12.0]}, 'feat5': {'feat': 'PR_MA_Ratio', 'data': [-0.0026525198938966]}, 'feat6': {'feat': 'Z_score', 'data': [-0.5754580027393497]}, 'feat7': {'feat': 'PR_MA_Ratio_short', 'data': [0.0147361206305715]}, 'feat8': {'feat': 'RSI', 'data': [0.5504199951161226]}, 'feat9': {'feat': 'boll', 'data': [0.3294279404490003]}}"
Merit CircleBEAM,,1.3929,669785.22,,https://www.rootdata.com/Projects/detail/Avalanche?k=MjUw,Decentralized blockchain,"https://www.avalabs.org/, https://x.com/Avax, https://t.me/avalancheavax, https://github.com/ava-labs/avalanchego, https://www.avalabs.org/whitepapers, https://medium.com/avalancheavax, https://coinmarketcap.com/currencies/avalanche/, https://forum.avax.network/, https://defillama.com/chain/Avalanche","Avalanche is a platform created by Ava Labs for creating custom blockchain networks and decentralized applications (dApps). It claims great scalability, with a high transaction throughput (TPS) of 4500 transactions per second. Its novel consensus protocol, Subnet infrastructure, and HyperSDK toolkit enable Web3 developers to easily launch powerful, custom blockchain solutions.",2018,"Emin Gün Sirer, Kevin Sekniqi, John Wu, Chris Lavery, Devika Mittal, John Nahas, Ed Chang, Polychain, Three Arrows Capital, Andreessen Horowitz, Dragonfly, Delphi Digital, CMS Holdings, NGC Ventures, IOSG Ventures, Galaxy, Lemniscap, Placeholder, Collab+Currency, Republic Capital, Youbi Capital, Fundamental Labs, Bitmain, LayerZero, Securitize, Platypus Finance, Bloktopia, Trader Joe, MUA DAO, Crypto Rogue Games, DeGame, Trustless Media, TimeShuffle, Banger Games, Kyro, BEAM+ LAB, Imperium Empires",,,1.03 M,627,"Sep 16, 2021 - Avalanche raised $ 230 M | Sep 22, 2020 - Avalanche was live on mainnet | Jul 15, 2020 - Avalanche raised $ 42 M in Public Sale round | Jun 25, 2020 - Avalanche raised $ 12 M in Private round | Feb 01, 2019 - Avalanche raised $ 6 M in funding round","#Ethereum, #Solana, #Aleo, #Hedera, #ZetaChain, #Internet Computer / Dfinity, #Algorand, #Celo",0.5731734,"{'feat0': {'feat': 'CDLUPSIDEGAP2CROWS', 'data': [0.0]}, 'feat1': {'feat': 'CDLBELTHOLD', 'data': [0.0]}, 'feat2': {'feat': 'CDLHARAMICROSS', 'data': [0.0]}, 'feat3': {'feat': 'CDLMARUBOZU', 'data': [0.0]}, 'feat4': {'feat': 'CDLCOUNTERATTACK', 'data': [0.0]}, 'feat5': {'feat': 'Hourly', 'data': [0.0]}, 'feat6': {'feat': 'CDLRISEFALL3METHODS', 'data': [0.0]}, 'feat7': {'feat': 'Z_score', 'data': [-0.5397840638011119]}, 'feat8': {'feat': 'RSI', 'data': [0.5281283081545691]}, 'feat9': {'feat': 'boll', 'data': [0.3498488842623228]}}"
BitgetBGB,,,,"Ethereum, Polygon, BNB Chain",https://www.rootdata.com/Projects/detail/Chainlink?k=MTg1,Oracle infrastructure,"https://chain.link/, https://x.com/chainlink, https://www.linkedin.com/company/chainlink-labs/, https://t.me/chainlinkofficial, https://github.com/smartcontractkit/chainlink, https://chain.link/whitepaper, https://medium.com/chainlink, https://coinmarketcap.com/currencies/chainlink/, https://www.coingecko.com/en/coins/chainlink","Chainlink provides smart contract developers with oracle infrastructure and tooling, which aims to provide reliable and accurate data for smart contracts running on blockchains.",2017,"Sergey Nazarov, Steve Ellis, Shuki Binyamin, Todd Barr, Johann Eid, Benedict Chan, Chirag Dhull, Patrick Young, Colin Cunningham, DLC.Link, Galaxis, Pop Social, ThirdFi, Hemera, Truflation, DECO, Rhombus",,https://x.com/chainlink,1.17 M,--,"May 30, 2019 - Chainlink was live on mainnet | Sep 20, 2017 - Chainlink raised $ 32 M through ICO","#Pyth Network, #RedStone, #DIA, #API3, #Supra, #Band Protocol, #SEDA, #Tellor",,
Binance.US,4285.83,1.7,649.12,,https://www.rootdata.com/Projects/detail/Bitcoin%20Cash?k=MjA0,Cryptocurrency that is a fork of Bitcoin,"https://gitlab.com/bitcoin-cash-node/, https://coinmarketcap.com/currencies/bitcoin-cash/","Bitcoin Cash is a cryptocurrency that intends to provide an alternative to Bitcoin. Launched in 2017, Bitcoin Cash was created by a group of Bitcoin users who disagreed with the roadmap proposed by the project's principal developer group, Bitcoin Core, and believed that different technical decisions were necessary to make Bitcoin available to a global audience.",2017,,"https://www.coingecko.com/learn/bitcoin-cash-bch, https://cointelegraph.com/news/bitcoin-cash-cashtokens-upgrade-on-its-network, https://coingeek.com/bch-forks-separating-bitcoin-abc-team-from-community/, https://cointelegraph.com/news/abc-vs-cv-assessing-the-consequences-of-the-bitcoin-cash-war",,,,,"#Bitcoin, #Litecoin, #Zcash, #Monero, #Bitcoin SV, #Verge, #FACT0RN, #Firo",0.32308188,"{'feat0': {'feat': 'CDLEVENINGSTAR', 'data': [0.0]}, 'feat1': {'feat': 'CDLGRAVESTONEDOJI', 'data': [0.0]}, 'feat2': {'feat': 'Month', 'data': [12.0]}, 'feat3': {'feat': 'ULTOSC', 'data': [0.4464831328478291]}, 'feat4': {'feat': 'Hourly', 'data': [0.0]}, 'feat5': {'feat': 'PR_MA_Ratio', 'data': [-0.0077445951264405]}, 'feat6': {'feat': 'Z_score', 'data': [-0.6610906380134957]}, 'feat7': {'feat': 'PR_MA_Ratio_short', 'data': [-0.0037156343688203]}, 'feat8': {'feat': 'RSI', 'data': [0.4739759334578738]}, 'feat9': {'feat': 'boll', 'data': [0.211025032056308]}}"
BonkBONK,,,,,https://www.rootdata.com/Projects/detail/Polkadot?k=MTE4,Cross-chain protocol,"https://polkadot.network/, https://x.com/Polkadot, https://t.me/PolkadotOfficial, https://github.com/paritytech/polkadot, https://github.com/paritytech/polkadot, https://medium.com/polkadot-network, https://coinmarketcap.com/currencies/polkadot-new/","Polkadot is a cross-chain protocol designed to connect and secure different blockchains. It provides interconnectivity and interoperability between them, enabling independent chains to securely exchange messages and perform transactions without relying on a trusted third-party. This allows for cross-chain transfers of data or assets between different blockchains, as well as the development of cross-chain DApps (decentralized applications) using the Polkadot Network. The Web3 Foundation is responsible for building Polkadot.",Plasm,"Gavin Wood, Alice und Bob, Pantera Capital, Polychain, Shima Capital, Arrington Capital, NGC Ventures, IOSG Ventures, Fabric Ventures, CoinFund, Zee Prime Capital, GenBlock Capital, 1confirmation, D1 Ventures, Hash CIB, Fundamental Labs, Continue Capital, KR1","https://blockworks.co/news/polkadots-jam-now-set-to-unlock-new-horizon-of-opportunities, https://cryptoslate.com/polkadots-new-storagehub-parachain-targets-improved-data-storage-efficiency/, https://medium.com/polkadot-network/polkadot-2023-roundup-7fe77d88f022?source=rss----c4f9788290b0---4, https://thedefiant.io/polkadot-is-about-to-fundamentally-change-said-web3-foundation-s-new-ceo, https://forkast.news/parity-technologies-polkadot-blockchain-layoffs/, https://medium.com/polkadot-network/polkadot-2022-roundup-d98ccf69df50?source=rss-3e5a7d431699------2, https://medium.com/polkadot-network/polkadot-roadmap-roundup-4ee64577a9ae?source=rss----c4f9788290b0---4, https://messari.io/article/polkadot-ecosystem-overview?referrer=list-view",https://x.com/Polkadot,1.48 M,7,"Jul 28, 2020 - Polkadot raised $ 43.3 M in funding round | May 01, 2020 - Polkadot was live on mainnet | Oct 17, 2017 - Polkadot raised $ 140 M through ICO","#Ethereum, #Solana, #Conflux, #Aleo, #Anoma Network, #PlatON, #Concordium, #NYM",,
Breakout,,,,,https://www.rootdata.com/Projects/detail/Sui?k=Mjc5Nw%3D%3D,Layer 1 blockchain,"https://sui.io/, https://x.com/SuiNetwork, https://github.com/MystenLabs, https://docs.sui.io/, https://medium.com/mysten-labs, https://coinmarketcap.com/currencies/sui/, https://defillama.com/chain/Sui","Sui is a permissionless Layer 1 blockchain, designed from the ground up to enable creators and developers to build experiences that cater to the next billion users in Web3. It is horizontally scalable, enabling a wide range of application development with unrivaled speed and low cost.",2022,"Evan Cheng, Adeniyi Abiodun, George Danezis, Sam Blackshear, Han Liu, Sina Nader, Andreessen Horowitz, FTX Ventures, Coinbase Ventures, Binance Labs, The Spartan Group, Cypher Capital Group, Arrington Capital, Electric Capital, Bixin Ventures, Samsung Next, Lightspeed Venture, Standard Crypto, Ryze Labs, Big Brain Holdings, Finality Capital Partners, Jump Crypto, XOCIETY, Switchboard, Scallop, Elixir, NAVI Protocol, Baby Shark Universe, Cetus, Aether Games, Karrier One, Releap Protocol, MovEX, Ethos, Scale3 Labs, Gameplay Galaxy, Dust Labs, SuiNS, Panzerdogs / WAGMI, Obelisk, Stashed",,https://x.com/SuiNetwork,689.71 K,480,"Jul 18, 2023 - Sui announced changes to the token release table, no major unlocks until May 2024 | May 03, 2023 - Sui was live on mainnet | Mar 30, 2023 - Sui Launches Permanent Testnet | Sep 08, 2022 - Sui raised $ 300 M in Series B round | May 05, 2022 - Sui DevNet is LIVE","#Ethereum, #Solana, #Aleo, #Hedera, #ZetaChain, #Internet Computer / Dfinity, #Algorand, #Celo",,
